Increased file descriptor limit: 1024 → 65536
[2025-12-21 16:43:38] Starting MyCloud Recovery Tool
[2025-12-21 16:43:38] Command: /home/chapman/projects/mycloud-restsdk-recovery-script/restsdk_public.py --resume --db=/mnt/backupdrive/restsdk/data/db/index.db --filedir=/mnt/backupdrive/restsdk/data/files --dumpdir=/mnt/nfs-media --log_file=/home/chapman/projects/mycloud-restsdk-recovery-script/copied_file.log --thread-count 2 --low-memory
[2025-12-21 16:43:38] Python: 3.12.3 (main, Nov  6 2025, 13:44:16) [GCC 13.3.0]
[2025-12-21 16:43:38] Platform: linux
[2025-12-21 16:43:38] Working directory: /home/chapman/projects/mycloud-restsdk-recovery-script
[2025-12-21 16:43:38] ----------------------------------------------------------------------
[2025-12-21 16:43:38] Start time: Sun Dec 21 16:43:38 2025

===== RUN STARTING =====
Start time: Sun Dec 21 16:43:38 2025
DB: /mnt/backupdrive/restsdk/data/db/index.db
Source: /mnt/backupdrive/restsdk/data/files
Destination: /mnt/nfs-media
Log file: /home/chapman/projects/mycloud-restsdk-recovery-script/copied_file.log
Thread count: 2
Dry run: False
Preserve mtime: False
Refresh mtime on existing: False
Sanitize pipes: False
Resume mode: ON, Will regenerate log: Yes (default)
========================

The size of the directory /mnt/backupdrive/restsdk/data/files is 1804.21 GB
🔋 Low-memory mode: skipping timestamp fields to reduce RAM usage
  (built fileDIC with 1655974 entries, freed raw DB results)
[2025-12-21 18:37:24] 
======================================================================
[2025-12-21 18:37:24]                          COPY OPERATION SUMMARY - INITIAL
[2025-12-21 18:37:24] ======================================================================
[2025-12-21 18:37:24] Timestamp: 2025-12-21 16:49:09
[2025-12-21 18:37:24] 
SOURCE DIRECTORY:
[2025-12-21 18:37:24]   Path: /mnt/backupdrive/restsdk/data/files
[2025-12-21 18:37:24]   Files in database: 1,655,974
[2025-12-21 18:37:24]   Scanning source directory (this may take a while)...
[2025-12-21 18:37:24]   Files found: 3,583,981
[2025-12-21 18:37:24]   Total size: 1.76 TB
[2025-12-21 18:37:24] 
DESTINATION DIRECTORY:
[2025-12-21 18:37:24]   Path: /mnt/nfs-media
[2025-12-21 18:37:24]   Scanning destination directory (this may take a while)...
[2025-12-21 18:37:24]   Existing files: 1,638,686
[2025-12-21 18:37:24]   Existing size: 1.92 TB
[2025-12-21 18:37:24] 
REMAINING:
[2025-12-21 18:37:24]   Files to copy: 17,288 (1.0% of total)
[2025-12-21 18:37:24] ======================================================================

[2025-12-21 18:37:24] Starting RESUME operation
Regenerating log file /home/chapman/projects/mycloud-restsdk-recovery-script/copied_file.log from destination /mnt/nfs-media before resuming and updating copied_files table...
Building path-to-ID lookup from database (this enables accurate matching)...
Building path lookup for 1655974 files...
  (stripping root dir prefix: auth0|5e62c7d40ec9700d5c82bb89...)
Built lookup with 1655972 file paths
Scanning destination directory and regenerating log file...
  [NO MATCH] Chapman Flood-20240823T154436Z-001.zip (not in source DB - may be manually added)
  [NO MATCH] Refinance2016.zip (not in source DB - may be manually added)
  [NO MATCH] KonnorFootballDocuments2024.zip (not in source DB - may be manually added)
  [NO MATCH] copied_file.log (not in source DB - may be manually added)
  [NO MATCH] index.db (not in source DB - may be manually added)
  [NO MATCH] ._ (not in source DB - may be manually added)
  [NO MATCH] #recycle/desktop.ini (not in source DB - may be manually added)
  [NO MATCH] #recycle/.com.apple.timemachine.supported-904497dd-63e5-4222-bd3e-d45449c92f81 (not in source DB - may be manually added)
  [NO MATCH] #recycle/.com.apple.timemachine.supported-b791b62e-76a-44cf-938d-c1947fffcf7b (not in source DB - may be manually added)
  [NO MATCH] #recycle/.com.apple.timemachine.supported-cc5c9276-3172-411a-880-946a11b69d16 (not in source DB - may be manually added)
  Progress: 10000 files scanned, 0 matched, 4187 unmatched...
  Progress: 20000 files scanned, 0 matched, 6794 unmatched...
  Progress: 30000 files scanned, 0 matched, 6794 unmatched...
  Progress: 40000 files scanned, 0 matched, 8940 unmatched...
  Progress: 50000 files scanned, 0 matched, 10582 unmatched...
  Progress: 60000 files scanned, 0 matched, 13008 unmatched...
  Progress: 70000 files scanned, 0 matched, 14944 unmatched...
  Progress: 80000 files scanned, 0 matched, 17497 unmatched...
  Progress: 90000 files scanned, 0 matched, 19274 unmatched...
  Progress: 100000 files scanned, 0 matched, 21306 unmatched...
  Progress: 110000 files scanned, 0 matched, 23536 unmatched...
  Progress: 120000 files scanned, 0 matched, 25797 unmatched...
  Progress: 130000 files scanned, 0 matched, 28067 unmatched...
  Progress: 140000 files scanned, 0 matched, 29891 unmatched...
  Progress: 150000 files scanned, 0 matched, 32158 unmatched...
  Progress: 160000 files scanned, 0 matched, 34213 unmatched...
  Progress: 170000 files scanned, 0 matched, 36311 unmatched...
  Progress: 180000 files scanned, 0 matched, 36311 unmatched...
  Progress: 190000 files scanned, 0 matched, 37990 unmatched...
  Progress: 200000 files scanned, 0 matched, 40029 unmatched...
  Progress: 210000 files scanned, 0 matched, 40029 unmatched...
  Progress: 220000 files scanned, 0 matched, 40029 unmatched...
  Progress: 230000 files scanned, 0 matched, 40029 unmatched...
  Progress: 240000 files scanned, 0 matched, 40029 unmatched...
  Progress: 250000 files scanned, 0 matched, 41429 unmatched...
  Progress: 260000 files scanned, 0 matched, 51313 unmatched...
  Progress: 270000 files scanned, 0 matched, 51313 unmatched...
  Progress: 280000 files scanned, 0 matched, 52667 unmatched...
  Progress: 290000 files scanned, 0 matched, 56593 unmatched...
  Progress: 300000 files scanned, 0 matched, 58931 unmatched...
  Progress: 310000 files scanned, 0 matched, 61037 unmatched...
  Progress: 320000 files scanned, 0 matched, 63234 unmatched...
  Progress: 330000 files scanned, 0 matched, 66487 unmatched...
  Progress: 340000 files scanned, 0 matched, 69662 unmatched...
  Progress: 350000 files scanned, 0 matched, 71457 unmatched...
  Progress: 360000 files scanned, 0 matched, 71870 unmatched...
  Progress: 370000 files scanned, 0 matched, 73905 unmatched...
  Progress: 380000 files scanned, 0 matched, 76014 unmatched...
  Progress: 390000 files scanned, 0 matched, 78326 unmatched...
  Progress: 400000 files scanned, 0 matched, 80397 unmatched...
  Progress: 410000 files scanned, 0 matched, 82983 unmatched...
  Progress: 420000 files scanned, 0 matched, 84891 unmatched...
  Progress: 430000 files scanned, 0 matched, 87027 unmatched...
  Progress: 440000 files scanned, 0 matched, 89258 unmatched...
  Progress: 450000 files scanned, 0 matched, 91255 unmatched...
  Progress: 460000 files scanned, 0 matched, 93637 unmatched...
  Progress: 470000 files scanned, 0 matched, 96698 unmatched...
  Progress: 480000 files scanned, 0 matched, 99671 unmatched...
  Progress: 490000 files scanned, 0 matched, 102690 unmatched...
  Progress: 500000 files scanned, 0 matched, 104444 unmatched...
  Progress: 510000 files scanned, 0 matched, 106258 unmatched...
  Progress: 520000 files scanned, 0 matched, 108336 unmatched...
  Progress: 530000 files scanned, 0 matched, 109470 unmatched...
  Progress: 540000 files scanned, 0 matched, 111895 unmatched...
  Progress: 550000 files scanned, 0 matched, 114016 unmatched...
  Progress: 560000 files scanned, 0 matched, 116422 unmatched...
  Progress: 570000 files scanned, 0 matched, 118627 unmatched...
  Progress: 580000 files scanned, 0 matched, 121036 unmatched...
  Progress: 590000 files scanned, 0 matched, 123783 unmatched...
  Progress: 600000 files scanned, 0 matched, 126626 unmatched...
  Progress: 610000 files scanned, 0 matched, 129182 unmatched...
  Progress: 620000 files scanned, 0 matched, 131558 unmatched...
  Progress: 630000 files scanned, 0 matched, 133839 unmatched...
  Progress: 640000 files scanned, 0 matched, 136243 unmatched...
  Progress: 650000 files scanned, 0 matched, 138665 unmatched...
  Progress: 660000 files scanned, 0 matched, 141029 unmatched...
  Progress: 670000 files scanned, 0 matched, 143400 unmatched...
  Progress: 680000 files scanned, 0 matched, 145665 unmatched...
  Progress: 690000 files scanned, 0 matched, 147490 unmatched...
  Progress: 700000 files scanned, 0 matched, 149556 unmatched...
  Progress: 710000 files scanned, 0 matched, 152305 unmatched...
  Progress: 720000 files scanned, 0 matched, 154224 unmatched...
  Progress: 730000 files scanned, 0 matched, 155970 unmatched...
  Progress: 740000 files scanned, 0 matched, 156820 unmatched...
  Progress: 750000 files scanned, 0 matched, 156820 unmatched...
  Progress: 760000 files scanned, 0 matched, 161480 unmatched...
  Progress: 770000 files scanned, 0 matched, 163240 unmatched...
  Progress: 780000 files scanned, 0 matched, 165245 unmatched...
  Progress: 790000 files scanned, 0 matched, 167334 unmatched...
  Progress: 800000 files scanned, 0 matched, 169802 unmatched...
  Progress: 810000 files scanned, 0 matched, 171766 unmatched...
  Progress: 820000 files scanned, 0 matched, 173638 unmatched...
  Progress: 830000 files scanned, 0 matched, 175850 unmatched...
  Progress: 840000 files scanned, 0 matched, 177920 unmatched...
  Progress: 850000 files scanned, 0 matched, 180133 unmatched...
  Progress: 860000 files scanned, 0 matched, 182337 unmatched...
  Progress: 870000 files scanned, 0 matched, 184547 unmatched...
  Progress: 880000 files scanned, 0 matched, 186680 unmatched...
  Progress: 890000 files scanned, 0 matched, 188707 unmatched...
  Progress: 900000 files scanned, 0 matched, 188716 unmatched...
  Progress: 910000 files scanned, 0 matched, 188716 unmatched...
  Progress: 920000 files scanned, 0 matched, 188716 unmatched...
  Progress: 930000 files scanned, 0 matched, 188716 unmatched...
  Progress: 940000 files scanned, 0 matched, 189347 unmatched...
  Progress: 950000 files scanned, 0 matched, 198461 unmatched...
  Progress: 960000 files scanned, 0 matched, 198461 unmatched...
  Progress: 970000 files scanned, 0 matched, 200714 unmatched...
  Progress: 980000 files scanned, 0 matched, 204706 unmatched...
  Progress: 990000 files scanned, 0 matched, 207651 unmatched...
  Progress: 1000000 files scanned, 0 matched, 210512 unmatched...
  Progress: 1010000 files scanned, 0 matched, 213443 unmatched...
  Progress: 1020000 files scanned, 0 matched, 216372 unmatched...
  Progress: 1030000 files scanned, 0 matched, 219275 unmatched...
  Progress: 1040000 files scanned, 0 matched, 222158 unmatched...
  Progress: 1050000 files scanned, 0 matched, 224526 unmatched...
  Progress: 1060000 files scanned, 0 matched, 226155 unmatched...
  Progress: 1070000 files scanned, 0 matched, 228019 unmatched...
  Progress: 1080000 files scanned, 0 matched, 230282 unmatched...
  Progress: 1090000 files scanned, 0 matched, 232565 unmatched...
  Progress: 1100000 files scanned, 0 matched, 234808 unmatched...
  Progress: 1110000 files scanned, 0 matched, 237004 unmatched...
  Progress: 1120000 files scanned, 0 matched, 237655 unmatched...
  Progress: 1130000 files scanned, 0 matched, 240550 unmatched...
  Progress: 1140000 files scanned, 0 matched, 242586 unmatched...
  Progress: 1150000 files scanned, 0 matched, 244232 unmatched...
  Progress: 1160000 files scanned, 0 matched, 245806 unmatched...
  Progress: 1170000 files scanned, 0 matched, 247472 unmatched...
  Progress: 1180000 files scanned, 0 matched, 249163 unmatched...
  Progress: 1190000 files scanned, 0 matched, 250884 unmatched...
  Progress: 1200000 files scanned, 0 matched, 252593 unmatched...
  Progress: 1210000 files scanned, 0 matched, 254241 unmatched...
  Progress: 1220000 files scanned, 0 matched, 255897 unmatched...
  Progress: 1230000 files scanned, 0 matched, 257526 unmatched...
  Progress: 1240000 files scanned, 0 matched, 259227 unmatched...
  Progress: 1250000 files scanned, 0 matched, 260822 unmatched...
  Progress: 1260000 files scanned, 0 matched, 262507 unmatched...
  Progress: 1270000 files scanned, 0 matched, 264096 unmatched...
  Progress: 1280000 files scanned, 0 matched, 265804 unmatched...
  Progress: 1290000 files scanned, 0 matched, 267478 unmatched...
  Progress: 1300000 files scanned, 0 matched, 268994 unmatched...
  Progress: 1310000 files scanned, 0 matched, 268994 unmatched...
  Progress: 1320000 files scanned, 0 matched, 268994 unmatched...
  Progress: 1330000 files scanned, 0 matched, 268994 unmatched...
  Progress: 1340000 files scanned, 0 matched, 268994 unmatched...
  Progress: 1350000 files scanned, 0 matched, 268994 unmatched...
  Progress: 1360000 files scanned, 0 matched, 268994 unmatched...
  Progress: 1370000 files scanned, 0 matched, 268994 unmatched...
  Progress: 1380000 files scanned, 0 matched, 268994 unmatched...
  Progress: 1390000 files scanned, 0 matched, 268994 unmatched...
  Progress: 1400000 files scanned, 0 matched, 268994 unmatched...
  Progress: 1410000 files scanned, 0 matched, 268994 unmatched...
  Progress: 1420000 files scanned, 0 matched, 268994 unmatched...
  Progress: 1430000 files scanned, 0 matched, 268994 unmatched...
  Progress: 1440000 files scanned, 0 matched, 268994 unmatched...
  Progress: 1450000 files scanned, 0 matched, 268994 unmatched...
  Progress: 1460000 files scanned, 0 matched, 268994 unmatched...
  Progress: 1470000 files scanned, 0 matched, 268994 unmatched...
  Progress: 1480000 files scanned, 0 matched, 268994 unmatched...
  Progress: 1490000 files scanned, 0 matched, 268994 unmatched...
  Progress: 1500000 files scanned, 0 matched, 268994 unmatched...
  Progress: 1510000 files scanned, 0 matched, 268994 unmatched...
  Progress: 1520000 files scanned, 0 matched, 268994 unmatched...
  Progress: 1530000 files scanned, 0 matched, 268994 unmatched...
  Progress: 1540000 files scanned, 0 matched, 276475 unmatched...
  Progress: 1550000 files scanned, 0 matched, 286475 unmatched...
  Progress: 1560000 files scanned, 0 matched, 296475 unmatched...
  Progress: 1570000 files scanned, 0 matched, 306475 unmatched...
  Progress: 1580000 files scanned, 0 matched, 315016 unmatched...
  Progress: 1590000 files scanned, 0 matched, 315016 unmatched...
  Progress: 1600000 files scanned, 0 matched, 315016 unmatched...
  Progress: 1610000 files scanned, 0 matched, 315016 unmatched...
  Progress: 1620000 files scanned, 0 matched, 321005 unmatched...
  Progress: 1630000 files scanned, 0 matched, 323591 unmatched...

Finished scanning destination directory.
  Total files scanned: 1638686
  Matched to source DB: 0
  Not in source DB: 327165 (these are ignored - may be manually added files)
  (freed temporary path lookup memory)
Log file and copied_files table regeneration complete in 2h 5m 27s. Resuming copy process...
Files to process: 344434 (filtered by copied_files and skipped_files tables)
File descriptor limit: soft=65536, hard=1048576

===== SUMMARY =====
Total files in source (files table): 1655974
Total files copied (copied_files table): 1311536
Total files skipped (skipped_files table): 4
Total files in destination directory: 1638686
Copied this run: 0
Skipped (already copied): 0
Skipped (problem/skipped): 344434
Errored: 0
Processed: 344434
Started at: Sun Dec 21 16:43:38 2025
Elapsed time: 4h 40m 5s (20.50 files/sec)
Regen duration: 2h 5m 27s
Copy phase duration: 40m 52s
[2025-12-21 21:23:44] 
Generating final summary...
[2025-12-21 22:02:49] 
======================================================================
[2025-12-21 22:02:49]                          COPY OPERATION SUMMARY - FINAL
[2025-12-21 22:02:49] ======================================================================
[2025-12-21 22:02:49] Timestamp: 2025-12-21 21:23:44
[2025-12-21 22:02:49] 
SOURCE DIRECTORY:
[2025-12-21 22:02:49]   Path: /mnt/backupdrive/restsdk/data/files
[2025-12-21 22:02:49]   Files in database: 1,655,974
[2025-12-21 22:02:49]   Scanning source directory (this may take a while)...
[2025-12-21 22:02:49]   Files found: 3,583,981
[2025-12-21 22:02:49]   Total size: 1.76 TB
[2025-12-21 22:02:49] 
DESTINATION DIRECTORY:
[2025-12-21 22:02:49]   Path: /mnt/nfs-media
[2025-12-21 22:02:49]   Scanning destination directory (this may take a while)...
[2025-12-21 22:02:49]   Existing files: 1,638,686
[2025-12-21 22:02:49]   Existing size: 1.92 TB
[2025-12-21 22:02:49] 
REMAINING:
[2025-12-21 22:02:49]   Files to copy: 17,288 (1.0% of total)
[2025-12-21 22:02:49]   Estimated time remaining: 3m 22s
[2025-12-21 22:02:49] ======================================================================

[2025-12-21 22:02:49] 
======================================================================
[2025-12-21 22:02:49] OPERATION COMPLETED SUCCESSFULLY
[2025-12-21 22:02:49] ======================================================================
[2025-12-21 22:02:49] Start time:    Sun Dec 21 16:43:38 2025
[2025-12-21 22:02:49] End time:      Sun Dec 21 22:02:49 2025
[2025-12-21 22:02:49] Total runtime: 5h 19m 10s
[2025-12-21 22:02:49] Log file:      /home/chapman/projects/mycloud-restsdk-recovery-script/summary_2025-12-21_16-43-38.log
[2025-12-21 22:02:49] ======================================================================
[2025-12-21 22:02:49] Cleaning up resources...
[2025-12-21 22:02:49] Exiting with code 0
